{
 "post_id": "zbebxYCqsryPALh8C",
 "repo": "noanabeshima/matryoshka-saes",
 "head_sha": "7b80f5fe36598f43f3181c5466a0365c7ce07807",
 "attempted_at": "2026-08-27",
 "machine": "NVIDIA GeForce RTX 3090, 580.126.18 / 24GB",
 "installs": true,
 "runs": true,
 "claim_located": true,
 "claim_reproduced": true,
 "claimed_value": "Matryoshka SAEs have higher MMC than vanilla SAEs at the same L0 across most locations (exceptions: residual stream before first block, first attention-layer output); at fixed L0, Matryoshka has slightly worse FVU, comparable to a vanilla SAE ~0.4x its size",
 "observed_value": "toy model: vanilla 9/20 latents absorbed (diag 0.66-0.75, parent cos 0.69-0.75); matryoshka 0/20 (diag min 0.923, max off-diag 0.188)",
 "delta": null,
 "tolerance_used": "abs:0.05",
 "blocking_reason": "none",
 "env_fixes": [
  "notebook copy train_saes_on_toy_repl.ipynb with a prepended 'import torch.nn.functional as F' (used but never imported); jupyter/nbconvert/ipykernel installed for the .ipynb entrypoint"
 ],
 "wallclock_minutes": 8.0,
 "peak_vram_gb": 2.9,
 "seeds_run": 1,
 "notes": "Toy-model component reproduced and quantified from the saved plotly heatmaps: vanilla decoder shows absorption for all 9 child features (diagonal 0.66-0.75, 0.69-0.75 onto the parent), Matryoshka decoder has none (diagonal >= 0.923, max off-diagonal 0.188). The LM component (MMC/FVU on a TinyStories 4-layer model) is not implemented in the repo per the spec's blocker; recorded as UNRESOLVED, tolerance abs:0.05 not applicable to the toy heatmaps. 8 min.",
 "artifact_paths": [
  "run.log",
  "vram.log",
  "executed.ipynb"
 ]
}