{
 "post_id": "JZK2xkedJwA7njKmN",
 "repo": "jordanmccann/polymorphism-is-rotation",
 "head_sha": "483a40a92f5aace73aff7d7041a34726e974aa79",
 "attempted_at": "2026-08-27",
 "machine": "NVIDIA GeForce RTX 3090, 580.126.18 / 24GB",
 "installs": true,
 "runs": true,
 "claim_located": true,
 "claim_reproduced": false,
 "claimed_value": "0.976-0.990 on toy model (vs worst-case -6.56 pre-rotation); 0.85-0.99 on Pythia-70m (vs -2.11 to 0.75 pre-rotation)",
 "observed_value": "toy post-rot SAE EV 0.977-0.991 (target 0.976-0.990); Pythia post-rot alignment EV 0.20-0.48 (target 0.85-0.99); KS vs Haar 0.00272, p=1.000; verify 6/6",
 "delta": null,
 "tolerance_used": "manual",
 "blocking_reason": "none",
 "env_fixes": [
  "python -m replicate fetch-artifacts before run-fast (cached activations/SAEs not in the lite clone); entrypoint run as the documented command rather than the catalogue prose"
 ],
 "wallclock_minutes": 58.0,
 "peak_vram_gb": null,
 "seeds_run": 1,
 "notes": "PARTIAL: toy-model recovery and the Haar-rotation statistics reproduce exactly (repo verify 6/6); the Pythia-70m post-rotation EV (0.85-0.99 claimed) comes out at 0.20-0.48 across 7 sites x 8 pairs while raw EV (-0.8 to -1.3) and ||R-I||_F (31.99 vs 32.0 predicted) match. The fast panel computes the Procrustes alignment EV without SAEs on 256x256 tokens; PAPER_NUMBERS.md attributes the claimed figure to the same script, so this is a real discrepancy rather than a different metric. Marked not reproduced because the spec's target_value names the Pythia range explicitly. 58 min run-fast + 5 min verify.",
 "artifact_paths": [
  "run.log",
  "vram.log"
 ]
}