{
 "post_id": "PagGF8roBJmjLunsX",
 "repo": "patrickod32/seq2feature",
 "head_sha": "f0616acd25cdf88a3c8c50e5786df5c45072d327",
 "attempted_at": "2026-08-28",
 "machine": "NVIDIA GeForce RTX 3090, 580.126.18 / 24GB",
 "installs": true,
 "runs": true,
 "claim_located": true,
 "claim_reproduced": true,
 "claimed_value": "0.956 top-5 agreement, 0.90 AUC (seq2feature int8, 5.3MB) vs 0.84/0.75 bag-of-words, 0.23/0.53 embedding baseline, 1.00/1.00 SAE teacher",
 "observed_value": "probe AUC 0.90 (target 0.90); keyword floor 0.75; probe 88% vs SAE 89% domain classification; beats keyword on 100% of concepts",
 "delta": null,
 "tolerance_used": "manual",
 "blocking_reason": "none",
 "env_fixes": [
  "notebook copy with Colab /content paths rewritten to the repo checkout; --allow-errors (final Colab files.download cell)"
 ],
 "wallclock_minutes": 5.0,
 "peak_vram_gb": 2.1,
 "seeds_run": 1,
 "notes": "Headline reproduced: median AUC 0.90 (=target 0.90) and keyword-floor 0.75 (=target bag-of-words 0.75) exact; probe classifies as well as the 9B SAE (88 vs 89%). The '0.956 top-5 agreement' scalar not isolated (final summary cell hit NameError('files') from an unstubbed Colab download under --allow-errors). 5 min, committed probe + data, no inference.",
 "artifact_paths": [
  "run.log",
  "vram.log",
  "executed.ipynb"
 ]
}